{
  "instrument": "forecast-live",
  "schemaVersion": 1,
  "status": "not-run",
  "plan": {
    "registrationId": "f4116541e9d258a8638b005b7499f5064090bdd595053d5a2f81701c54d76bf3",
    "source": {
      "head": "456700987263a2de18d9a7981755b1f34e8c3b67",
      "sha256": "36dc4e87895da77a9a9250a91cb7536c31596459b262bfa908c35fa9e547c5d0",
      "files": [
        {
          "path": "benchmark/fixtures/forecast/harness/candidates.json",
          "sha256": "bcaa0268e6dde9d43edacf1ab613224ae1a558a17024045e0704a46b3b51a970"
        },
        {
          "path": "benchmark/fixtures/forecast/harness/seed.json",
          "sha256": "f6a974a43638889b5c02c993622870957a32bb9e82ff4d68744df4582ea1a9c0"
        },
        {
          "path": "benchmark/fixtures/forecast/manifest.json",
          "sha256": "062d0c7f2fe76e2b0e2b272a196c5d0a64386f0aacebe51832143ef75a4f97a9"
        },
        {
          "path": "benchmark/fixtures/forecast/questions.json",
          "sha256": "1cb8dc9b3f73f6df06aa36244aa1dbbf7140015f41a27234ac280db9c783ea6a"
        },
        {
          "path": "benchmark/fixtures/forecast/resolutions.json",
          "sha256": "afae79da3829a58ef2a6eed9e4031e6839056e50282e1ce54ba63976fde4f5c2"
        },
        {
          "path": "benchmark/fixtures/forecast/scripted/duplicates.json",
          "sha256": "60f2f95165e43b3448a2d3fe565a373fc926800ba8b21f13ba83527511c30acb"
        },
        {
          "path": "benchmark/fixtures/forecast/scripted/feedback.json",
          "sha256": "329ad2193c5f5f67236bff1022fd1129a23719870b62ef4a32a59b5f5f332246"
        },
        {
          "path": "benchmark/fixtures/forecast/scripted/leaks.json",
          "sha256": "36d1e9719d45dcc279b97a5499d18824281d1583da370ec2123e9525cf5081db"
        },
        {
          "path": "benchmark/fixtures/forecast/scripted/notes.json",
          "sha256": "7eac4b64185e46cc94319199279f186d820eff28aa9df780250009fd52bd5731"
        },
        {
          "path": "benchmark/fixtures/forecast/scripted/predictions.json",
          "sha256": "50fca49641d9e13bff72fe9778d6494086c36629fec046495edc9c904df4275a"
        },
        {
          "path": "benchmark/fixtures/forecast/snapshots.json",
          "sha256": "056084446e40d191b1c673c0da19afa617d8f2097454ca02191e4d7f5810ebb2"
        },
        {
          "path": "benchmark/forecast.ts",
          "sha256": "8a39ab2345f2f54887d3e87a208c8ad8ca00c86b92d357eaa46194de3bcec81e"
        },
        {
          "path": "benchmark/lib/ai-env.ts",
          "sha256": "5b584540fdfe9b0a879d2b0476eb46ab0a9babc8d2a187a2811ba6cf1f332a2a"
        },
        {
          "path": "benchmark/lib/args.ts",
          "sha256": "d243ac26d4beb119ec3254786a79140cf34d30373c3655714c08b96159707ab0"
        },
        {
          "path": "benchmark/lib/authoring-probes.ts",
          "sha256": "158e96d802343a5d296d2936e4340f1af64f9f5bde1a42abba3f18839f56e9a8"
        },
        {
          "path": "benchmark/lib/authoring-schema.ts",
          "sha256": "58c7d010302d60a51614051c46a5234c59222fff271d2da5a76c52632df811bc"
        },
        {
          "path": "benchmark/lib/authoring.ts",
          "sha256": "e31459abcb6361842149aebb40425f668a675a9f2f2c52bf32b4d7dc892b1fcd"
        },
        {
          "path": "benchmark/lib/cgt-claim.ts",
          "sha256": "b466e76e8215c224bb0c1532e2dd80cb055a9a7b8704ded93368ec223f3b925b"
        },
        {
          "path": "benchmark/lib/cgt-evaluation-fixtures.ts",
          "sha256": "f441bc62c47b440e2413f344b0b86bc2f55a0b1ad9a32e7d472baccc692de1eb"
        },
        {
          "path": "benchmark/lib/cgt-evaluation.ts",
          "sha256": "a6f05e871d860b3c2c92875251eb5033b09aa7e9c76b8ee9c814e8ebafb74840"
        },
        {
          "path": "benchmark/lib/cgt-experiences.ts",
          "sha256": "9c2f1f847cdcf2af5a583a1f0de047c76d1423da40c105c74768a1de56e5d231"
        },
        {
          "path": "benchmark/lib/cgt-fixture.ts",
          "sha256": "a31262a2d747720312adea36093bc0436fbb2a05d7cd2a494060f8cb656296cd"
        },
        {
          "path": "benchmark/lib/cgt-rows.ts",
          "sha256": "dbcdfbe773674486963b815c3af3a1a60cd5f3d89482fe90655a9a9f6089c327"
        },
        {
          "path": "benchmark/lib/cgt-scorer.ts",
          "sha256": "55982fa5382af46a2ef41f21a324c709aea42ade3c9400e72257416d1fee9296"
        },
        {
          "path": "benchmark/lib/cgt.ts",
          "sha256": "4e63c370dafdc75d12d7c85ccaef796154039d9d6e7b5247939a777c1197d570"
        },
        {
          "path": "benchmark/lib/cgt.types.ts",
          "sha256": "79fe18536d2995873d86178dcfe7ab74b9700e409820253163894c8bfc8b022d"
        },
        {
          "path": "benchmark/lib/config-conformance.ts",
          "sha256": "9a27ce957cec7933c5ef5c27e37676893469ae803f2f52a1c45c2c960902ece5"
        },
        {
          "path": "benchmark/lib/config-conformance.types.ts",
          "sha256": "03538ba9422b2eb9e40d4621778f965900735f800f714289c37ec6c987b59775"
        },
        {
          "path": "benchmark/lib/consolidate-bm25-reference.ts",
          "sha256": "872b57c846c8d3971cd28eb6c8598d2fde2f82b2f179d6f38edce63bd201e59b"
        },
        {
          "path": "benchmark/lib/consolidate-candidates.ts",
          "sha256": "b35974157440ba19a2b402bce217de85593d3f11d12653ae4db8669200a73cbf"
        },
        {
          "path": "benchmark/lib/consolidate-execution-probes.ts",
          "sha256": "b7ba8f7ce3cc9ea5089dcebc7e57cdc08568969bc3eb0c6af99637510886dd70"
        },
        {
          "path": "benchmark/lib/consolidate-scripted.ts",
          "sha256": "c24b8fe788faf1f5f615f037fbdaacbae0dfe369dbf081160808fa9ce5c63f30"
        },
        {
          "path": "benchmark/lib/consolidate-source.ts",
          "sha256": "3db969d41408234dfb0e4a0b42c16653c39758c2f1f8a8721fbabf25f4e9d373"
        },
        {
          "path": "benchmark/lib/consolidate-storage.ts",
          "sha256": "ed0147f1c96517e4b1a576fcede9202b49524a569a31f4fab3ad2003da43c97a"
        },
        {
          "path": "benchmark/lib/consolidate-store-probes.ts",
          "sha256": "5f8ad9b7d3c5ebd61c1d679243d33d2271ebcdd8eaa49bc7506510b1994fa176"
        },
        {
          "path": "benchmark/lib/consolidate-trigger-probes.ts",
          "sha256": "0446ed544d41ce03d3ddb6f363919070e5bdd1df6aad4719c4ef3f741af06b26"
        },
        {
          "path": "benchmark/lib/consolidate.ts",
          "sha256": "698cbe12b50893bd508258a9ff6596872dd4e8d51a5823b49226d98192cff75f"
        },
        {
          "path": "benchmark/lib/env.ts",
          "sha256": "37d73b655e24a2e7d8753bd93e5ae486e900cfa826e81d834ac992f9e2e2b97b"
        },
        {
          "path": "benchmark/lib/evolve-fixture.ts",
          "sha256": "3a75d927433926f987564b743aa786571af280734aed8d9ff61a928570a0fb82"
        },
        {
          "path": "benchmark/lib/evolve-host.ts",
          "sha256": "250a07c35fb8d3f36384caf5367448d0303a2ebc2f3a735f49767fc8b48fb78e"
        },
        {
          "path": "benchmark/lib/evolve-lifecycle.ts",
          "sha256": "d2543554f519201bd8d893f74e1885ee5162262a26162c4c5f0cd6481de877b5"
        },
        {
          "path": "benchmark/lib/evolve-probes.ts",
          "sha256": "2be05a7d37a84f9cc6778c4fd023632160b003a6b90576bb8ab338d240fc7f4d"
        },
        {
          "path": "benchmark/lib/evolve-selection.ts",
          "sha256": "600584aa0fcc4b35aca7a2abdb3301a1edb3cbd0e2179ae1bbed4626d3f77bcb"
        },
        {
          "path": "benchmark/lib/evolve-selection.types.ts",
          "sha256": "3e7d1afb0f13affeb4c04b51dd01745a152e02c8a2b8e25ba1dfb5e957277ef0"
        },
        {
          "path": "benchmark/lib/evolve.ts",
          "sha256": "2720771bf826ac5443aecc5db68723bbd6ad56ea16044149fc494ecb7590e54d"
        },
        {
          "path": "benchmark/lib/evolve.types.ts",
          "sha256": "14109947dacd1761efdf64669ba5f15d9634ab0a433bcf28898f3ba3b2bd7d6c"
        },
        {
          "path": "benchmark/lib/fmt.ts",
          "sha256": "a748d11d0aca0d388c8e7fe59c9a05e8767f879219047261a9cfbedd491fa332"
        },
        {
          "path": "benchmark/lib/forecast-ablations.ts",
          "sha256": "58dd3dd9e368181ebf374e5226121dc070765aaefb7c96e35bbc7b1242620e2e"
        },
        {
          "path": "benchmark/lib/forecast-evolving.ts",
          "sha256": "72b8574bba42dbc43660b11f8e50cc865ce8c75323bd1971fca542d333344dc3"
        },
        {
          "path": "benchmark/lib/forecast-fixtures.ts",
          "sha256": "f5d525a3848214d527837735af3cf43a68ed17620e9a8edd2d2c6e6ea50a9e62"
        },
        {
          "path": "benchmark/lib/forecast-host-fixture.ts",
          "sha256": "54a5f48c53c4eb07d02e6ae67e6cfe2c625e4f234d68d60a7df8c92b15686b8b"
        },
        {
          "path": "benchmark/lib/forecast-lifecycle-fixture.ts",
          "sha256": "7727999317916e1336d4350a540905f3fd71e934ecd5058ca7015e94383b28ea"
        },
        {
          "path": "benchmark/lib/forecast-lifecycle-probes.ts",
          "sha256": "60c0734b0a7bb13aeed043882b8fbc0db7ac7b127993f7239f69a30c8fc313a2"
        },
        {
          "path": "benchmark/lib/forecast-lifecycle-resume.ts",
          "sha256": "65addb6b386692a4037972091257e6a28a063db009dc4e45d1d905d46756243e"
        },
        {
          "path": "benchmark/lib/forecast-live-execution.ts",
          "sha256": "0a140bca28dc79ffaca29d1c2da85ce2f0e1f3a39fbcee4ae6afc42b346fa5d8"
        },
        {
          "path": "benchmark/lib/forecast-live.ts",
          "sha256": "2b1101a482c50c166c6a59818792e3749981fbe3cf59f830f60219aa681a92f3"
        },
        {
          "path": "benchmark/lib/forecast-live.types.ts",
          "sha256": "5991138c2c860357bc05c820c61c86c102d24fad4a8f16ff5cae08bef174f0b5"
        },
        {
          "path": "benchmark/lib/forecast-longrun.ts",
          "sha256": "6a5f13149dbb85bb329b5e056ead66f7d24a9e402a9d254e7d2135846e85859e"
        },
        {